{
  "fixture": {
    "features_sha256": "1f5a39a930ed636303f57d190293521a33e8da58c92555b366d23c786cad98bf",
    "reference_scores_sha256": "595a629617d5801c60cb2489d51da53cfbe84f391ee413c33ad4de98b58748ca"
  },
  "metrics": {
    "avg_error_mean": 0.006222882000000001,
    "failures": 0,
    "max_error_max": 0.0915527,
    "per_utterance": [
      {
        "avg_error": 0.00580374,
        "frames": 250,
        "index": 0,
        "infer_ms_per_frame": 21.3085,
        "max_error": 0.0674734,
        "rms_error": 0.00738084,
        "stdev_error": 0.0048913
      },
      {
        "avg_error": 0.00625914,
        "frames": 441,
        "index": 1,
        "infer_ms_per_frame": 21.3133,
        "max_error": 0.0830717,
        "rms_error": 0.0079807,
        "stdev_error": 0.00540017
      },
      {
        "avg_error": 0.00641429,
        "frames": 347,
        "index": 2,
        "infer_ms_per_frame": 21.3142,
        "max_error": 0.0911465,
        "rms_error": 0.00816784,
        "stdev_error": 0.00560137
      },
      {
        "avg_error": 0.00630222,
        "frames": 407,
        "index": 3,
        "infer_ms_per_frame": 21.3291,
        "max_error": 0.0915527,
        "rms_error": 0.00801894,
        "stdev_error": 0.00550325
      },
      {
        "avg_error": 0.00620579,
        "frames": 353,
        "index": 4,
        "infer_ms_per_frame": 21.3133,
        "max_error": 0.0660477,
        "rms_error": 0.00789219,
        "stdev_error": 0.00533821
      },
      {
        "avg_error": 0.00578733,
        "frames": 372,
        "index": 5,
        "infer_ms_per_frame": 21.3167,
        "max_error": 0.0752602,
        "rms_error": 0.00740206,
        "stdev_error": 0.00504598
      },
      {
        "avg_error": 0.00642625,
        "frames": 214,
        "index": 6,
        "infer_ms_per_frame": 21.3162,
        "max_error": 0.0791626,
        "rms_error": 0.00819442,
        "stdev_error": 0.00561381
      },
      {
        "avg_error": 0.00645779,
        "frames": 318,
        "index": 7,
        "infer_ms_per_frame": 21.3143,
        "max_error": 0.0641937,
        "rms_error": 0.00823247,
        "stdev_error": 0.00565919
      },
      {
        "avg_error": 0.00631335,
        "frames": 285,
        "index": 8,
        "infer_ms_per_frame": 21.3172,
        "max_error": 0.0869398,
        "rms_error": 0.0080218,
        "stdev_error": 0.00546652
      },
      {
        "avg_error": 0.00625892,
        "frames": 414,
        "index": 9,
        "infer_ms_per_frame": 21.3142,
        "max_error": 0.0896015,
        "rms_error": 0.00797501,
        "stdev_error": 0.00554226
      }
    ],
    "rms_error_mean": 0.007926627000000002,
    "total_frames": 3401,
    "utterance_avg_infer_ms_per_frame_p50": 21.31425,
    "utterance_avg_infer_ms_per_frame_p95": 21.323745,
    "utterances": 10,
    "weighted_mean_infer_ms_per_frame": 21.31601402528668
  },
  "model": {
    "bin_sha256": "a27a0f9ebf4a235e6789d746940ba07941c236b5930efdafdf8ffd771be79195",
    "family": "rm_cnn4a",
    "id": "rm_cnn4a-fp16",
    "xml_sha256": "5fbc7dc2327a22d75bcd4b27d98f73689fdaf047fc16ee57be3ea507670d4d35"
  },
  "provenance": {
    "command": [
      "/home/chris/workspace/movidius-openvino-rpi5/run.sh",
      "--platform",
      "arm64",
      "speech-regress"
    ],
    "model_load_ms": 1972.68,
    "model_spec_sha256": "a3bd4eddba2ff45227b97dabf0b708356e0d34b6adde989abcb420018ca364a2",
    "raw_log_sha256": "e7a215e99113cd5c251303fd063a8644695fa37086395e051ac27e74d49fc323"
  },
  "runtime": {
    "backend": "MYRIAD",
    "openvino_version": "2020.3.2",
    "repo_commit": "b80232bb646ed3cea30c9dc5091f567350491e52",
    "target": "arm64"
  },
  "schema": "speech-asr/acoustic-regression-result",
  "status": "completed",
  "version": 1
}
